{
  "schema_version": "1.1.0",
  "id": "FED_VNH_APPLY",
  "kind": "federal",
  "version": 2,
  "status": "draft",
  "title": "Подайте заявление на ВНЖ по выбранному законному основанию",
  "summary": "Зафиксируйте конкретное основание ВНЖ и приложите подтверждающие его документы.",
  "category": "stay_status",
  "research_process_ids": [
    "PROC_VNH"
  ],
  "actor": "student",
  "obligation": "optional",
  "applicability": {
    "op": "all",
    "args": [
      {
        "op": "eq",
        "fact": "foreign_person",
        "value": true
      },
      {
        "op": "all",
        "args": [
          {
            "op": "eq",
            "fact": "wants_vnh",
            "value": true
          },
          {
            "op": "eq",
            "fact": "vnh_ground_confirmed",
            "value": true
          }
        ]
      }
    ]
  },
  "trigger": {
    "kind": "event",
    "event_type": "vnh_selected",
    "occurrence": "each",
    "where": {
      "op": "always"
    }
  },
  "deadline": {
    "kind": "unknown",
    "unresolved_ids": [
      "UNR_STEP_VNH_APPLY"
    ]
  },
  "instructions": [
    "Зафиксируйте конкретное основание ВНЖ и приложите подтверждающие его документы.",
    "Подайте заявление в компетентное подразделение МВД в допустимое для этого основания окно; сохраните подтверждение."
  ],
  "documents": [
    {
      "id": "DOC_IDENTITY",
      "title": "Паспорт иностранного гражданина или иной допустимый документ личности",
      "requirement": "required",
      "form": "original",
      "evidence": [
        {
          "source_id": "SRC_VNH",
          "locator": "Вид на жительство: категории заявителей",
          "supports": "Указанный документ в пределах описанного источником способа обращения."
        }
      ]
    }
  ],
  "destination": {
    "kind": "authority",
    "name": "Территориальный орган МВД",
    "selection_basis": "По компетенции для документально подтверждённого основания ВНЖ.",
    "information_url": "https://pvsmvd.ru/services/140",
    "appointment_required": "unknown",
    "resolution": "select_local_service_point",
    "unresolved_ids": []
  },
  "result": {
    "title": "Заявление о выдаче ВНЖ подано",
    "completion_mode": "user_confirmation",
    "instructions": "Отметить действие после фактического выполнения; подача заявления не означает положительное решение."
  },
  "exceptions": [
    {
      "description": "Диплом с отличием и путь после РВПО — разные основания, нельзя требовать красный диплом от всех выпускников.",
      "unresolved_ids": [
        "UNR_VNH",
        "UNR_CURRENT_EDITION"
      ]
    }
  ],
  "warnings": [
    {
      "id": "WARN_VNH_APPLY",
      "severity": "blocking",
      "message": "В карточке сохранена подтверждённая часть. Окно обычного РВП нельзя переносить на выпускника с РВПО. Точные основания, сроки, документы и освобождения проверить; диплом с отличием не универсальное требование.",
      "unresolved_ids": [
        "UNR_STEP_VNH_APPLY"
      ]
    },
    {
      "id": "WARN_AUDIT_CHANGES",
      "severity": "blocking",
      "message": "Подтвердить действия и сроки при смене паспорта, статуса, переводе/академическом отпуске/отчислении, аннулировании документа и длительном выезде. Пересчет применимости не равен исполнению уведомительной обязанности.",
      "unresolved_ids": [
        "UNR_AUDIT_CHANGES"
      ]
    },
    {
      "id": "WARN_AUDIT_SPECIAL",
      "severity": "blocking",
      "message": "Раскрыть лица без гражданства, убежище/беженство, особые указные режимы и несколько гражданств. Не сводить их к обычному temporary_stay или одному выбранному паспорту.",
      "unresolved_ids": [
        "UNR_AUDIT_SPECIAL"
      ]
    }
  ],
  "depends_on": [],
  "effective_period": {},
  "evidence": [
    {
      "source_id": "SRC_VNH",
      "locator": "Вид на жительство: категории заявителей — относящийся к действию раздел; ограничения в аудите",
      "supports": "Условия отобранной ветки; факты подтверждённого основания не вычисляются по неподтверждённым признакам.",
      "fields": [
        "/applicability"
      ],
      "checked_on": "2026-09-26",
      "support_level": "partial"
    },
    {
      "source_id": "SRC_VNH",
      "locator": "Вид на жительство: категории заявителей — относящийся к действию раздел; ограничения в аудите",
      "supports": "Событие сервиса, соответствующее фактическому началу действия; это не отдельное правовое требование.",
      "fields": [
        "/trigger"
      ],
      "checked_on": "2026-09-26",
      "support_level": "partial"
    },
    {
      "source_id": "SRC_VNH",
      "locator": "Вид на жительство: категории заявителей — относящийся к действию раздел; ограничения в аудите",
      "supports": "Компетентная организация/канал в пределах описанного способа обращения.",
      "fields": [
        "/destination"
      ],
      "checked_on": "2026-09-26",
      "support_level": "partial"
    },
    {
      "source_id": "SRC_VNH",
      "locator": "Вид на жительство: категории заявителей — относящийся к действию раздел; ограничения в аудите",
      "supports": "Ожидаемый документ или факт подачи; положительное решение не обещается.",
      "fields": [
        "/result"
      ],
      "checked_on": "2026-09-26",
      "support_level": "partial"
    },
    {
      "source_id": "SRC_VNH",
      "locator": "Вид на жительство: категории заявителей — относящийся к действию раздел; ограничения в аудите",
      "supports": "Обязательность относится только к подтверждённой области применимости.",
      "fields": [
        "/obligation"
      ],
      "checked_on": "2026-09-26",
      "support_level": "partial"
    },
    {
      "source_id": "SRC_VNH",
      "locator": "Вид на жительство: категории заявителей — относящийся к действию раздел; ограничения в аудите",
      "supports": "Паспорт иностранного гражданина или иной допустимый документ личности",
      "fields": [
        "/documents/0"
      ],
      "checked_on": "2026-09-26",
      "support_level": "partial"
    },
    {
      "source_id": "SRC_VNH",
      "locator": "Вид на жительство: категории заявителей — относящийся к действию раздел; ограничения в аудите",
      "supports": "Диплом с отличием и путь после РВПО — разные основания, нельзя требовать красный диплом от всех выпускников.",
      "fields": [
        "/exceptions"
      ],
      "checked_on": "2026-09-26",
      "support_level": "partial"
    },
    {
      "source_id": "SRC_VNH",
      "locator": "Вид на жительство: категории заявителей — относящийся к действию раздел; ограничения в аудите",
      "supports": "Зафиксируйте конкретное основание ВНЖ и приложите подтверждающие его документы. Подтверждение ограничено указанным источником и зарегистрированными пробелами.",
      "fields": [
        "/instructions/0"
      ],
      "checked_on": "2026-09-26",
      "support_level": "partial"
    },
    {
      "source_id": "SRC_VNH",
      "locator": "Вид на жительство: категории заявителей — относящийся к действию раздел; ограничения в аудите",
      "supports": "Подайте заявление в компетентное подразделение МВД в допустимое для этого основания окно; сохраните подтверждение. Подтверждение ограничено указанным источником и зарегистрированными пробелами.",
      "fields": [
        "/instructions/1"
      ],
      "checked_on": "2026-09-26",
      "support_level": "partial"
    }
  ],
  "unresolved_ids": [
    "UNR_STEP_VNH_APPLY",
    "UNR_VNH",
    "UNR_CURRENT_EDITION",
    "UNR_AUDIT_CHANGES",
    "UNR_AUDIT_SPECIAL"
  ],
  "review": {
    "reviewed_at": "2026-09-26T06:25:00Z",
    "reviewer": "Отдельный аудит профилей и границ применения; неподтвержденные поля сохранены как блокирующие пробелы",
    "next_review_on": "2026-10-26"
  },
  "field_gaps": [
    {
      "fields": [
        "/deadline"
      ],
      "unresolved_id": "UNR_STEP_VNH_APPLY",
      "note": "Не подставлять начало/конец дня, календарь или неизвестную единицу. Автоматический дедлайн заблокирован."
    },
    {
      "fields": [
        "/applicability",
        "/documents",
        "/exceptions"
      ],
      "unresolved_id": "UNR_STEP_VNH_APPLY",
      "note": "Окно обычного РВП нельзя переносить на выпускника с РВПО. Точные основания, сроки, документы и освобождения проверить; диплом с отличием не универсальное требование."
    },
    {
      "fields": [
        "/applicability",
        "/trigger"
      ],
      "unresolved_id": "UNR_AUDIT_CHANGES",
      "note": "Подтвердить действия и сроки при смене паспорта, статуса, переводе/академическом отпуске/отчислении, аннулировании документа и длительном выезде. Пересчет применимости не равен исполнению уведомительной обязанности."
    },
    {
      "fields": [
        "/applicability"
      ],
      "unresolved_id": "UNR_AUDIT_SPECIAL",
      "note": "Раскрыть лица без гражданства, убежище/беженство, особые указные режимы и несколько гражданств. Не сводить их к обычному temporary_stay или одному выбранному паспорту."
    }
  ]
}
