{
  "schema_version": "1.1.0",
  "id": "FED_VISA_RESTORE",
  "kind": "federal",
  "version": 1,
  "status": "draft",
  "title": "Подайте в МВД заявление о восстановлении или переносе визы",
  "summary": "Предъявите новый документ личности и сообщите обстоятельства утраты/замены прежнего документа с визой.",
  "category": "changes",
  "research_process_ids": [
    "PROC_LOST_PASSPORT"
  ],
  "actor": "student",
  "obligation": "mandatory_when_applicable",
  "applicability": {
    "op": "all",
    "args": [
      {
        "op": "eq",
        "fact": "foreign_person",
        "value": true
      },
      {
        "op": "eq",
        "fact": "visa_restoration_required",
        "value": true
      }
    ]
  },
  "trigger": {
    "kind": "event",
    "event_type": "replacement_passport_received",
    "occurrence": "each",
    "where": {
      "op": "always"
    }
  },
  "deadline": {
    "kind": "unknown",
    "unresolved_ids": [
      "UNR_STEP_VISA_RESTORE"
    ]
  },
  "instructions": [
    "Предъявите новый документ личности и сообщите обстоятельства утраты/замены прежнего документа с визой.",
    "Подайте визовую анкету для соответствующей процедуры восстановления; сохраните подтверждение обращения."
  ],
  "documents": [
    {
      "id": "DOC_IDENTITY",
      "title": "Паспорт иностранного гражданина или иной допустимый документ личности",
      "requirement": "required",
      "form": "original",
      "evidence": [
        {
          "source_id": "SRC_VISA907",
          "locator": "Приказ МВД № 907: пункты 24, 26–27 (подача/продление), 32 и 156 (получение); редакция опубликованной страницы 15.11.2022",
          "supports": "Указанный документ в пределах описанного источником способа обращения."
        }
      ]
    },
    {
      "id": "DOC_VISA_FORM",
      "title": "Визовая анкета",
      "requirement": "required",
      "form": "unspecified",
      "evidence": [
        {
          "source_id": "SRC_VISA907",
          "locator": "Приказ МВД № 907: пункты 24, 26–27 (подача/продление), 32 и 156 (получение); редакция опубликованной страницы 15.11.2022",
          "supports": "Указанный документ в пределах описанного источником способа обращения."
        }
      ]
    }
  ],
  "destination": {
    "kind": "authority",
    "name": "Подразделение по вопросам миграции МВД",
    "selection_basis": "По визовому регламенту для восстановления/переноса.",
    "information_url": "https://pvsmvd.ru/docs/135",
    "appointment_required": "unknown",
    "resolution": "select_local_service_point",
    "unresolved_ids": []
  },
  "result": {
    "title": "Обращение о восстановлении визы подано",
    "completion_mode": "user_confirmation",
    "instructions": "Отметить действие после фактического выполнения; подача заявления не означает положительное решение."
  },
  "exceptions": [
    {
      "description": "Свидетельство на возвращение не равно новому паспорту для продолжения учёбы.",
      "unresolved_ids": [
        "UNR_LOST_PASSPORT",
        "UNR_CURRENT_EDITION"
      ]
    }
  ],
  "warnings": [
    {
      "id": "WARN_VISA_RESTORE",
      "severity": "blocking",
      "message": "В карточке сохранена подтверждённая часть. Точное основание, дополнительные документы, сбор и срок обращения/выезда не установлены; не считать новый паспорт автоматически визированным.",
      "unresolved_ids": [
        "UNR_STEP_VISA_RESTORE"
      ]
    }
  ],
  "depends_on": [],
  "effective_period": {},
  "evidence": [
    {
      "source_id": "SRC_VISA907",
      "locator": "Приказ МВД № 907: пункты 24, 26–27 (подача/продление), 32 и 156 (получение); редакция опубликованной страницы 15.11.2022",
      "supports": "Условия отобранной ветки; факты подтверждённого основания не вычисляются по неподтверждённым признакам.",
      "fields": [
        "/applicability"
      ],
      "checked_on": "2026-09-26",
      "support_level": "partial"
    },
    {
      "source_id": "SRC_VISA907",
      "locator": "Приказ МВД № 907: пункты 24, 26–27 (подача/продление), 32 и 156 (получение); редакция опубликованной страницы 15.11.2022",
      "supports": "Событие сервиса, соответствующее фактическому началу действия; это не отдельное правовое требование.",
      "fields": [
        "/trigger"
      ],
      "checked_on": "2026-09-26",
      "support_level": "partial"
    },
    {
      "source_id": "SRC_VISA907",
      "locator": "Приказ МВД № 907: пункты 24, 26–27 (подача/продление), 32 и 156 (получение); редакция опубликованной страницы 15.11.2022",
      "supports": "Компетентная организация/канал в пределах описанного способа обращения.",
      "fields": [
        "/destination"
      ],
      "checked_on": "2026-09-26",
      "support_level": "partial"
    },
    {
      "source_id": "SRC_VISA907",
      "locator": "Приказ МВД № 907: пункты 24, 26–27 (подача/продление), 32 и 156 (получение); редакция опубликованной страницы 15.11.2022",
      "supports": "Ожидаемый документ или факт подачи; положительное решение не обещается.",
      "fields": [
        "/result"
      ],
      "checked_on": "2026-09-26",
      "support_level": "partial"
    },
    {
      "source_id": "SRC_VISA907",
      "locator": "Приказ МВД № 907: пункты 24, 26–27 (подача/продление), 32 и 156 (получение); редакция опубликованной страницы 15.11.2022",
      "supports": "Обязательность относится только к подтверждённой области применимости.",
      "fields": [
        "/obligation"
      ],
      "checked_on": "2026-09-26",
      "support_level": "partial"
    },
    {
      "source_id": "SRC_VISA907",
      "locator": "Приказ МВД № 907: пункты 24, 26–27 (подача/продление), 32 и 156 (получение); редакция опубликованной страницы 15.11.2022",
      "supports": "Паспорт иностранного гражданина или иной допустимый документ личности",
      "fields": [
        "/documents/0"
      ],
      "checked_on": "2026-09-26",
      "support_level": "partial"
    },
    {
      "source_id": "SRC_VISA907",
      "locator": "Приказ МВД № 907: пункты 24, 26–27 (подача/продление), 32 и 156 (получение); редакция опубликованной страницы 15.11.2022",
      "supports": "Визовая анкета",
      "fields": [
        "/documents/1"
      ],
      "checked_on": "2026-09-26",
      "support_level": "partial"
    },
    {
      "source_id": "SRC_VISA907",
      "locator": "Приказ МВД № 907: пункты 24, 26–27 (подача/продление), 32 и 156 (получение); редакция опубликованной страницы 15.11.2022",
      "supports": "Свидетельство на возвращение не равно новому паспорту для продолжения учёбы.",
      "fields": [
        "/exceptions"
      ],
      "checked_on": "2026-09-26",
      "support_level": "partial"
    },
    {
      "source_id": "SRC_VISA907",
      "locator": "Приказ МВД № 907: пункты 24, 26–27 (подача/продление), 32 и 156 (получение); редакция опубликованной страницы 15.11.2022",
      "supports": "Предъявите новый документ личности и сообщите обстоятельства утраты/замены прежнего документа с визой. Подтверждение ограничено указанным источником и зарегистрированными пробелами.",
      "fields": [
        "/instructions/0"
      ],
      "checked_on": "2026-09-26",
      "support_level": "partial"
    },
    {
      "source_id": "SRC_VISA907",
      "locator": "Приказ МВД № 907: пункты 24, 26–27 (подача/продление), 32 и 156 (получение); редакция опубликованной страницы 15.11.2022",
      "supports": "Подайте визовую анкету для соответствующей процедуры восстановления; сохраните подтверждение обращения. Подтверждение ограничено указанным источником и зарегистрированными пробелами.",
      "fields": [
        "/instructions/1"
      ],
      "checked_on": "2026-09-26",
      "support_level": "partial"
    }
  ],
  "unresolved_ids": [
    "UNR_STEP_VISA_RESTORE",
    "UNR_LOST_PASSPORT",
    "UNR_CURRENT_EDITION"
  ],
  "review": {
    "reviewed_at": "2026-09-26T06:06:57Z",
    "reviewer": "Проверка федеральной карточки по сохранённым и повторно прочитанным государственным материалам",
    "next_review_on": "2026-10-26"
  },
  "field_gaps": [
    {
      "fields": [
        "/deadline"
      ],
      "unresolved_id": "UNR_STEP_VISA_RESTORE",
      "note": "Не подставлять начало/конец дня, календарь или неизвестную единицу. Автоматический дедлайн заблокирован."
    },
    {
      "fields": [
        "/applicability",
        "/documents",
        "/exceptions"
      ],
      "unresolved_id": "UNR_STEP_VISA_RESTORE",
      "note": "Точное основание, дополнительные документы, сбор и срок обращения/выезда не установлены; не считать новый паспорт автоматически визированным."
    }
  ]
}
