{
  "schema_version": "1.1.0",
  "id": "FED_RVPO_APPLY",
  "kind": "federal",
  "version": 2,
  "status": "draft",
  "title": "Подайте заявление на РВПО",
  "summary": "Подайте личное заявление на РВПО в территориальный орган МВД по месту обучения.",
  "category": "stay_status",
  "research_process_ids": [
    "PROC_RVPO"
  ],
  "actor": "student",
  "obligation": "optional",
  "applicability": {
    "op": "all",
    "args": [
      {
        "op": "eq",
        "fact": "foreign_person",
        "value": true
      },
      {
        "op": "all",
        "args": [
          {
            "op": "eq",
            "fact": "wants_rvpo",
            "value": true
          },
          {
            "op": "eq",
            "fact": "is_enrolled",
            "value": true
          },
          {
            "op": "eq",
            "fact": "full_time",
            "value": true
          },
          {
            "op": "eq",
            "fact": "state_education_or_science_org",
            "value": true
          },
          {
            "op": "eq",
            "fact": "rvpo_program_eligible",
            "value": true
          }
        ]
      }
    ]
  },
  "trigger": {
    "kind": "event",
    "event_type": "rvpo_selected",
    "occurrence": "each",
    "where": {
      "op": "always"
    }
  },
  "deadline": {
    "kind": "unknown",
    "unresolved_ids": [
      "UNR_STEP_RVPO_APPLY"
    ]
  },
  "instructions": [
    "Подайте личное заявление на РВПО в территориальный орган МВД по месту обучения.",
    "Представьте документ о зачислении на подходящую очную программу и подтверждённые документы личности; сохраните подтверждение приёма."
  ],
  "documents": [
    {
      "id": "DOC_IDENTITY",
      "title": "Паспорт иностранного гражданина или иной допустимый документ личности",
      "requirement": "required",
      "form": "original",
      "evidence": [
        {
          "source_id": "SRC_RVPO_GUIDE",
          "locator": "Разрешение на временное проживание в целях получения образования",
          "supports": "Указанный документ в пределах описанного источником способа обращения."
        }
      ]
    },
    {
      "id": "DOC_ENROLLMENT",
      "title": "Документ о зачислении/обучении",
      "requirement": "required",
      "form": "unspecified",
      "evidence": [
        {
          "source_id": "SRC_RVPO",
          "locator": "Разъяснение Минобрнауки: очные программы государственных организаций и срок РВПО",
          "supports": "Указанный документ в пределах описанного источником способа обращения."
        }
      ]
    }
  ],
  "destination": {
    "kind": "authority",
    "name": "Территориальный орган МВД по месту обучения",
    "selection_basis": "Компетенция определяется местом подходящей образовательной/научной организации.",
    "information_url": "https://epp.genproc.gov.ru/ru/proc_33/activity/legal-education/explain/e314670/",
    "appointment_required": "unknown",
    "resolution": "select_local_service_point",
    "unresolved_ids": []
  },
  "result": {
    "title": "Заявление на РВПО подано",
    "completion_mode": "user_confirmation",
    "instructions": "Отметить действие после фактического выполнения; подача заявления не означает положительное решение."
  },
  "exceptions": [
    {
      "description": "Разъяснения предусматривают освобождение от языкового подтверждения и ежегодного уведомления; точные нормы проверить.",
      "unresolved_ids": [
        "UNR_RVPO",
        "UNR_CURRENT_EDITION"
      ]
    }
  ],
  "warnings": [
    {
      "id": "WARN_RVPO_APPLY",
      "severity": "blocking",
      "message": "В карточке сохранена подтверждённая часть. Регламент № 949 и полный комплект, срок услуги/подачи и исключения для отдельных программ требуют проверки. Срок обучения плюс 180 дней — действие РВПО, не дедлайн заявления.",
      "unresolved_ids": [
        "UNR_STEP_RVPO_APPLY"
      ]
    },
    {
      "id": "WARN_AUDIT_CHANGES",
      "severity": "blocking",
      "message": "Подтвердить действия и сроки при смене паспорта, статуса, переводе/академическом отпуске/отчислении, аннулировании документа и длительном выезде. Пересчет применимости не равен исполнению уведомительной обязанности.",
      "unresolved_ids": [
        "UNR_AUDIT_CHANGES"
      ]
    }
  ],
  "depends_on": [],
  "effective_period": {},
  "evidence": [
    {
      "source_id": "SRC_RVPO",
      "locator": "Разъяснение Минобрнауки: очные программы государственных организаций и срок РВПО",
      "supports": "Условия отобранной ветки; факты подтверждённого основания не вычисляются по неподтверждённым признакам.",
      "fields": [
        "/applicability"
      ],
      "checked_on": "2026-09-26",
      "support_level": "partial"
    },
    {
      "source_id": "SRC_RVPO",
      "locator": "Разъяснение Минобрнауки: очные программы государственных организаций и срок РВПО",
      "supports": "Событие сервиса, соответствующее фактическому началу действия; это не отдельное правовое требование.",
      "fields": [
        "/trigger"
      ],
      "checked_on": "2026-09-26",
      "support_level": "partial"
    },
    {
      "source_id": "SRC_RVPO",
      "locator": "Разъяснение Минобрнауки: очные программы государственных организаций и срок РВПО",
      "supports": "Компетентная организация/канал в пределах описанного способа обращения.",
      "fields": [
        "/destination"
      ],
      "checked_on": "2026-09-26",
      "support_level": "partial"
    },
    {
      "source_id": "SRC_RVPO",
      "locator": "Разъяснение Минобрнауки: очные программы государственных организаций и срок РВПО",
      "supports": "Ожидаемый документ или факт подачи; положительное решение не обещается.",
      "fields": [
        "/result"
      ],
      "checked_on": "2026-09-26",
      "support_level": "partial"
    },
    {
      "source_id": "SRC_RVPO",
      "locator": "Разъяснение Минобрнауки: очные программы государственных организаций и срок РВПО",
      "supports": "Обязательность относится только к подтверждённой области применимости.",
      "fields": [
        "/obligation"
      ],
      "checked_on": "2026-09-26",
      "support_level": "partial"
    },
    {
      "source_id": "SRC_RVPO_GUIDE",
      "locator": "Разрешение на временное проживание в целях получения образования — относящийся к действию раздел; ограничения в аудите",
      "supports": "Паспорт иностранного гражданина или иной допустимый документ личности",
      "fields": [
        "/documents/0"
      ],
      "checked_on": "2026-09-26",
      "support_level": "partial"
    },
    {
      "source_id": "SRC_RVPO",
      "locator": "Разъяснение Минобрнауки: очные программы государственных организаций и срок РВПО",
      "supports": "Документ о зачислении/обучении",
      "fields": [
        "/documents/1"
      ],
      "checked_on": "2026-09-26",
      "support_level": "partial"
    },
    {
      "source_id": "SRC_RVPO",
      "locator": "Разъяснение Минобрнауки: очные программы государственных организаций и срок РВПО",
      "supports": "Разъяснения предусматривают освобождение от языкового подтверждения и ежегодного уведомления; точные нормы проверить.",
      "fields": [
        "/exceptions"
      ],
      "checked_on": "2026-09-26",
      "support_level": "partial"
    },
    {
      "source_id": "SRC_RVPO",
      "locator": "Разъяснение Минобрнауки: очные программы государственных организаций и срок РВПО",
      "supports": "Подайте личное заявление на РВПО в территориальный орган МВД по месту обучения. Подтверждение ограничено указанным источником и зарегистрированными пробелами.",
      "fields": [
        "/instructions/0"
      ],
      "checked_on": "2026-09-26",
      "support_level": "partial"
    },
    {
      "source_id": "SRC_RVPO",
      "locator": "Разъяснение Минобрнауки: очные программы государственных организаций и срок РВПО",
      "supports": "Представьте документ о зачислении на подходящую очную программу и подтверждённые документы личности; сохраните подтверждение приёма. Подтверждение ограничено указанным источником и зарегистрированными пробелами.",
      "fields": [
        "/instructions/1"
      ],
      "checked_on": "2026-09-26",
      "support_level": "partial"
    }
  ],
  "unresolved_ids": [
    "UNR_STEP_RVPO_APPLY",
    "UNR_RVPO",
    "UNR_CURRENT_EDITION",
    "UNR_AUDIT_CHANGES"
  ],
  "review": {
    "reviewed_at": "2026-09-26T06:25:00Z",
    "reviewer": "Отдельный аудит профилей и границ применения; неподтвержденные поля сохранены как блокирующие пробелы",
    "next_review_on": "2026-10-26"
  },
  "field_gaps": [
    {
      "fields": [
        "/deadline"
      ],
      "unresolved_id": "UNR_STEP_RVPO_APPLY",
      "note": "Не подставлять начало/конец дня, календарь или неизвестную единицу. Автоматический дедлайн заблокирован."
    },
    {
      "fields": [
        "/applicability",
        "/documents",
        "/exceptions"
      ],
      "unresolved_id": "UNR_STEP_RVPO_APPLY",
      "note": "Регламент № 949 и полный комплект, срок услуги/подачи и исключения для отдельных программ требуют проверки. Срок обучения плюс 180 дней — действие РВПО, не дедлайн заявления."
    },
    {
      "fields": [
        "/applicability",
        "/trigger"
      ],
      "unresolved_id": "UNR_AUDIT_CHANGES",
      "note": "Подтвердить действия и сроки при смене паспорта, статуса, переводе/академическом отпуске/отчислении, аннулировании документа и длительном выезде. Пересчет применимости не равен исполнению уведомительной обязанности."
    }
  ]
}
